id,category,brand,model,title,description,price,discount,stock,rating,review_count,color,warranty,features,tags
208,لپ‌تاپ,ام‌اس‌آی,MacBook Air M2 (نسخه جدید),ام‌اس‌آی MacBook Air M2 (نسخه جدید) - مشکی,محصول ام‌اس‌آی مدل MacBook Air M2 (نسخه جدید) با ویژگی‌های نمایشگر Full HD IPS | پورت Thunderbolt 4 | کارت گرافیک RTX 3050. بهترین انتخاب در دسته لپ‌تاپ.,94615000,30,20,3.5,3419,مشکی,۱۲ ماه گارانتی,نمایشگر Full HD IPS | پورت Thunderbolt 4 | کارت گرافیک RTX 3050 | وزن ۱.۵ کیلو,گیمینگ، قدرتمند، کامپیوتر، اداری
209,کفش,کالباندی,Colorado Lite,کالباندی Colorado Lite - قرمز,Colorado Lite از برند معتبر کالباندی. سبک وزن ۳۰۰ گرم | تکنولوژی Air Cushion | پنجه پهن. کیفیت تضمینی.,680000,0,200,3.7,1514,قرمز,۱۲ ماه گارانتی,سبک وزن ۳۰۰ گرم | تکنولوژی Air Cushion | پنجه پهن | قابل شستشو,کوهنوردی، ورزشی، رسمی، کفش
210,لوازم آرایشی,لورئال,رژلب ویژه,لورئال رژلب ویژه - متنوع,پیشنهاد ویژه: لورئال رژلب ویژه. رنگ‌های متنوع | پوشش کامل | مناسب پوست حساس. ارسال سریع.,290000,0,150,2.8,106,متنوع,بدون گارانتی,رنگ‌های متنوع | پوشش کامل | مناسب پوست حساس | فرمول ضدآب,زنانه، بهداشتی، ضدآب، زیبایی
211,مکمل ورزشی,بی‌اس‌ان,ال-کارنیتین (2024),بی‌اس‌ان ال-کارنیتین (2024) - متنوع,ال-کارنیتین (2024) از برند معتبر بی‌اس‌ان. ۳۰ وعده در هر بسته | سطح کراتین ۵ گرم | انحلال سریع. کیفیت تضمینی.,4340000,30,50,5.0,2099,متنوع,۲۴ ماه گارانتی,۳۰ وعده در هر بسته | سطح کراتین ۵ گرم | انحلال سریع | طعم شکلات,ورزش، پروتئین، مکمل، کراتین
212,تبلت,آمازون,MatePad 11 Ultra,آمازون MatePad 11 Ultra - خاکستری,محصول آمازون مدل MatePad 11 Ultra با ویژگی‌های پشتیبانی از قلم هوشمند | کیفیت نمایش 2K | پردازنده A16 Bionic. بهترین انتخاب در دسته تبلت.,27720000,0,20,2.5,2192,خاکستری,۱۸ ماه گارانتی,پشتیبانی از قلم هوشمند | کیفیت نمایش 2K | پردازنده A16 Bionic | باتری ۱۰۰۰۰ میلی‌آمپر,آموزش، تبلت، ترسیم دیجیتال، iPad
213,عطر,ورساچه,Bleu de Chanel Lite,ورساچه Bleu de Chanel Lite - شفاف,محصول ورساچه مدل Bleu de Chanel Lite با ویژگی‌های بوی مردانه خشبی | جعبه هدیه | اسپری محافظت. بهترین انتخاب در دسته عطر.,1940000,0,0,4.1,1172,شفاف,۱۸ ماه گارانتی,بوی مردانه خشبی | جعبه هدیه | اسپری محافظت | بوی تازه سیتروسی,زنانه، مردانه، هدیه، لوکس
214,تجهیزات کمپینگ,نورث فیس,کوله ۶۰ لیتری,نورث فیس کوله ۶۰ لیتری - نارنجی,پیشنهاد ویژه: نورث فیس کوله ۶۰ لیتری. استرپ کمپرسیون | ضدآب ۳۰۰۰mm | پوشش UV. ارسال سریع.,3610000,20,200,2.8,253,نارنجی,۱۲ ماه گارانتی,استرپ کمپرسیون | ضدآب ۳۰۰۰mm | پوشش UV | مقاوم در برابر باد ۶۰ کیلومتر,ماجراجویی، طبیعت‌گردی، ورزش، کمپینگ
215,کیبورد,کینگستون,ROG Strix Scope Ultra,کینگستون ROG Strix Scope Ultra - خاکستری,محصول کینگستون مدل ROG Strix Scope Ultra با ویژگی‌های ضدآب | سوئیچ مکانیکی Cherry MX | کلیدهای ماکرو. بهترین انتخاب در دسته کیبورد.,4570000,0,150,3.1,958,خاکستری,۱۲ ماه گارانتی,ضدآب | سوئیچ مکانیکی Cherry MX | کلیدهای ماکرو | عمر کلید ۱۰۰ میلیون ضربه,کیبورد، بی‌سیم، مکانیکال، اداری
216,کتاب,انتشارات ققنوس,رمان ادبی Max,انتشارات ققنوس رمان ادبی Max - متنوع,رمان ادبی Max از برند معتبر انتشارات ققنوس. قطع وزیری | نمایه جامع | ویرایش دوم. کیفیت تضمینی.,145000,10,50,4.7,3342,متنوع,۱۲ ماه گارانتی,قطع وزیری | نمایه جامع | ویرایش دوم | ترجمه تخصصی,رمان، ادبیات، مطالعه، کتاب
217,مانیتور,ایسر,Optix MAG274QRF (نسخه جدید),ایسر Optix MAG274QRF (نسخه جدید) - سفید,Optix MAG274QRF (نسخه جدید) از برند معتبر ایسر. نرخ تازه‌سازی ۱۴۴Hz | ارتفاع قابل تنظیم | رزولوشن 4K UHD. کیفیت تضمینی.,57345000,10,150,4.8,3097,سفید,۱۸ ماه گارانتی,نرخ تازه‌سازی ۱۴۴Hz | ارتفاع قابل تنظیم | رزولوشن 4K UHD | پوشش رنگی sRGB 99%,صفحه‌نمایش، اداری، طراحی، گیمینگ
218,تلویزیون,سونی,OLED C3 55 SE,سونی OLED C3 55 SE - خاکستری تیره,OLED C3 55 SE از برند معتبر سونی. نرخ تازه‌سازی ۱۲۰Hz | Google TV | کیفیت 4K OLED. کیفیت تضمینی.,40050000,25,0,2.9,3299,خاکستری تیره,۶ ماه گارانتی,نرخ تازه‌سازی ۱۲۰Hz | Google TV | کیفیت 4K OLED | پورت HDMI 2.1,تلویزیون، اسمارت، سینمای خانگی، TV
219,چای‌ساز,گاستروبک,BY500 SE,گاستروبک BY500 SE - سفید,پیشنهاد ویژه: گاستروبک BY500 SE. دمای قابل تنظیم | حفظ گرما | حرارت سریع. ارسال سریع.,1385000,30,10,4.1,1688,سفید,۱۲ ماه گارانتی,دمای قابل تنظیم | حفظ گرما | حرارت سریع | بدنه استیل,کتری برقی، چای‌ساز، آشپزخانه، خانگی
220,دسته بازی,سونی,Xbox Wireless Controller Pro,سونی Xbox Wireless Controller Pro - مشکی,پیشنهاد ویژه: سونی Xbox Wireless Controller Pro. لرزش هپتیک | باتری ۴۰ ساعته | ماشه تطبیقی. ارسال سریع.,3515000,20,30,3.7,3246,مشکی,۱۲ ماه گارانتی,لرزش هپتیک | باتری ۴۰ ساعته | ماشه تطبیقی | اتصال بی‌سیم,گیمینگ، دسته بازی، کنترلر، PS5
221,سرخ‌کن,مولینکس,DL-745 Max,مولینکس DL-745 Max - مشکی,DL-745 Max از برند معتبر مولینکس. دمای ۸۰-۲۰۰ درجه | تایمر دیجیتال | حرارت سریع. کیفیت تضمینی.,2990000,25,50,3.9,2511,مشکی,۲۴ ماه گارانتی,دمای ۸۰-۲۰۰ درجه | تایمر دیجیتال | حرارت سریع | سبد قابل شستشو در ماشین,آشپزخانه، هواپز، سالم، بدون روغن
222,لپ‌تاپ,دل,Inspiron 15 SE,دل Inspiron 15 SE - نقره‌ای,محصول دل مدل Inspiron 15 SE با ویژگی‌های SSD 512 گیگ | کارت گرافیک RTX 3050 | پورت Thunderbolt 4. بهترین انتخاب در دسته لپ‌تاپ.,47810000,0,5,3.5,163,نقره‌ای,بدون گارانتی,SSD 512 گیگ | کارت گرافیک RTX 3050 | پورت Thunderbolt 4 | نمایشگر Full HD IPS,کامپیوتر، قدرتمند، اداری، گیمینگ
223,لپ‌تاپ,دل,Surface Pro 9 Pro,دل Surface Pro 9 Pro - مشکی,Surface Pro 9 Pro از برند معتبر دل. کارت گرافیک RTX 3050 | SSD 512 گیگ | رم ۱۶ گیگ. کیفیت تضمینی.,94100000,25,0,4.2,2276,مشکی,۲۴ ماه گارانتی,کارت گرافیک RTX 3050 | SSD 512 گیگ | رم ۱۶ گیگ | نمایشگر Full HD IPS,سبک، لپ‌تاپ، کامپیوتر، گیمینگ
224,جاروبرقی,ایرووا,G10 Prime Ultra,ایرووا G10 Prime Ultra - آبی,ایرووا G10 Prime Ultra - باتری ۶۰ دقیقه | وزن ۳ کیلو | بدون کیسه. مناسب برای کاربران جاروبرقی.,10985000,0,5,3.7,2499,آبی,۱۸ ماه گارانتی,باتری ۶۰ دقیقه | وزن ۳ کیلو | بدون کیسه | فیلتر HEPA,بدون کیسه، شارژی، لوازم خانگی، نظافت
225,کیبورد,کورسیر,HyperX Alloy FPS Ultra,کورسیر HyperX Alloy FPS Ultra - سفید,پیشنهاد ویژه: کورسیر HyperX Alloy FPS Ultra. ضدآب | کلیدهای ماکرو | عمر کلید ۱۰۰ میلیون ضربه. ارسال سریع.,9145000,10,5,3.5,395,سفید,۱۸ ماه گارانتی,ضدآب | کلیدهای ماکرو | عمر کلید ۱۰۰ میلیون ضربه | بلوتوث بی‌سیم,گیمینگ، بی‌سیم، مکانیکال، کیبورد
226,دوچرخه,ویوا,Marlin 5 Ultra,ویوا Marlin 5 Ultra - نارنجی,محصول ویوا مدل Marlin 5 Ultra با ویژگی‌های چرخ ۲۷.۵ اینچ | وزن ۱۴ کیلو | دنده ۲۱ سرعته. بهترین انتخاب در دسته دوچرخه.,15880000,0,15,4.5,1276,نارنجی,بدون گارانتی,چرخ ۲۷.۵ اینچ | وزن ۱۴ کیلو | دنده ۲۱ سرعته | فریم آلومینیوم,شهری، MTB، ورزش، دوچرخه
227,اسباب‌بازی,هاسبرو,Baby Einstein Plus,هاسبرو Baby Einstein Plus - قرمز,پیشنهاد ویژه: هاسبرو Baby Einstein Plus. مناسب ۳+ سال | صدا و نور | قابل شستشو. ارسال سریع.,1055000,30,15,2.8,922,قرمز,بدون گارانتی,مناسب ۳+ سال | صدا و نور | قابل شستشو | رنگ غیر سمی,آموزشی، لگو، کودک، اسباب‌بازی
228,مودم,ایسوس,Nighthawk AX12 Plus,ایسوس Nighthawk AX12 Plus - سفید,ایسوس Nighthawk AX12 Plus - پردازنده ۱.۸ گیگاهرتز | پوشش ۳۰۰ متر مربع | ۸ آنتن خارجی. مناسب برای کاربران مودم.,7040000,0,0,3.5,1256,سفید,۳۶ ماه گارانتی,پردازنده ۱.۸ گیگاهرتز | پوشش ۳۰۰ متر مربع | ۸ آنتن خارجی | QoS پیشرفته,خانه هوشمند، روتر، اینترنت، Wi-Fi
229,هندزفری,انکر,AirPods Pro 2 (نسخه جدید),انکر AirPods Pro 2 (نسخه جدید) - سفید,پیشنهاد ویژه: انکر AirPods Pro 2 (نسخه جدید). حذف نویز فعال | صدای استریو | لمسی. ارسال سریع.,9140000,25,200,2.9,1532,سفید,۲۴ ماه گارانتی,حذف نویز فعال | صدای استریو | لمسی | کیس شارژ,بی‌سیم، مکالمه، ایرپاد، هندزفری
230,پوشاک مردانه,پوما,بلیزر,پوما بلیزر - سفید,محصول پوما مدل بلیزر با ویژگی‌های دوخت محکم | جیب دار | تنفس‌پذیر. بهترین انتخاب در دسته پوشاک مردانه.,405000,0,10,2.6,1434,سفید,۱۲ ماه گارانتی,دوخت محکم | جیب دار | تنفس‌پذیر | ضدچروک,مردانه، پوشاک، مد، ورزشی
231,لوازم خودرو,بوش,آداپتور OBD2 Lite,بوش آداپتور OBD2 Lite - مشکی,پیشنهاد ویژه: بوش آداپتور OBD2 Lite. صفحه لمسی ۳.۵ اینچ | شارژ سریع | Wi-Fi داخلی. ارسال سریع.,7475000,0,20,2.9,2434,مشکی,۲۴ ماه گارانتی,صفحه لمسی ۳.۵ اینچ | شارژ سریع | Wi-Fi داخلی | GPS مکان‌یاب,ایمنی، لوازم ماشین، خودرو، GPS
232,تجهیزات کمپینگ,کایالاس,کوله ۶۰ لیتری Plus,کایالاس کوله ۶۰ لیتری Plus - سبز,محصول کایالاس مدل کوله ۶۰ لیتری Plus با ویژگی‌های نصب ۵ دقیقه‌ای | تنفس‌پذیر GoreTex | ضدآب ۳۰۰۰mm. بهترین انتخاب در دسته تجهیزات کمپینگ.,525000,5,15,3.7,878,سبز,۱۸ ماه گارانتی,نصب ۵ دقیقه‌ای | تنفس‌پذیر GoreTex | ضدآب ۳۰۰۰mm | استرپ کمپرسیون,ماجراجویی، طبیعت‌گردی، ورزش، کوهنوردی
233,چای‌ساز,گاستروبک,EKS-3655 (2024),گاستروبک EKS-3655 (2024) - سفید,گاستروبک EKS-3655 (2024) - حرارت سریع | دمای قابل تنظیم | چراغ LED. مناسب برای کاربران چای‌ساز.,1695000,30,5,4.8,1306,سفید,بدون گارانتی,حرارت سریع | دمای قابل تنظیم | چراغ LED | بدنه استیل,خانگی، کتری برقی، آشپزخانه، چای‌ساز
234,موبایل,ریلمی,C55 ویژه,ریلمی C55 ویژه - آبی,ریلمی C55 ویژه - دوربین ۱۰۸ مگاپیکسل | 5G | نمایشگر AMOLED. مناسب برای کاربران موبایل.,29905000,0,150,3.2,2579,آبی,۶ ماه گارانتی,دوربین ۱۰۸ مگاپیکسل | 5G | نمایشگر AMOLED | پردازنده Snapdragon 8 Gen2,دوربین عالی، هوشمند، iOS، گوشی
235,موبایل,شیائومی,Redmi Note 12 (2024),شیائومی Redmi Note 12 (2024) - بنفش,پیشنهاد ویژه: شیائومی Redmi Note 12 (2024). شارژ سریع ۶۷ وات | حافظه داخلی ۲۵۶ گیگ | پردازنده Snapdragon 8 Gen2. ارسال سریع.,18715000,25,15,4.3,1639,بنفش,۳۶ ماه گارانتی,شارژ سریع ۶۷ وات | حافظه داخلی ۲۵۶ گیگ | پردازنده Snapdragon 8 Gen2 | 5G,5G، هوشمند، اندروید، iOS
236,پوشاک زنانه,زارا,بلوز Plus,زارا بلوز Plus - سفید,زارا بلوز Plus - بدون ترنسپارنت | جنس ویسکوز نرم | جیب مخفی. مناسب برای کاربران پوشاک زنانه.,1985000,25,30,3.9,1115,سفید,۱۸ ماه گارانتی,بدون ترنسپارنت | جنس ویسکوز نرم | جیب مخفی | یقه گرد,تابستانه، مد، زنانه، پوشاک
237,ساعت هوشمند,شیائومی,Sense 2 (2024),شیائومی Sense 2 (2024) - گلد,پیشنهاد ویژه: شیائومی Sense 2 (2024). اکسیژن خون SpO2 | نمایشگر AMOLED | مانیتور خواب. ارسال سریع.,4455000,10,20,3.3,3169,گلد,بدون گارانتی,اکسیژن خون SpO2 | نمایشگر AMOLED | مانیتور خواب | ردیابی ضربان قلب,اسمارت‌واچ، ساعت هوشمند، سلامت، ورزشی
238,مکمل ورزشی,متاکس,BCAA Pro,متاکس BCAA Pro - متنوع,BCAA Pro از برند معتبر متاکس. تأیید شده آزمایشگاهی | ۳۰ وعده در هر بسته | مناسب گیاهخوار. کیفیت تضمینی.,2770000,25,0,2.7,2027,متنوع,۱۲ ماه گارانتی,تأیید شده آزمایشگاهی | ۳۰ وعده در هر بسته | مناسب گیاهخوار | طعم شکلات,پروتئین، بدنسازی، سلامت، کراتین
239,لوازم حیوانات,پورینا,اسباب‌بازی گربه Pro,پورینا اسباب‌بازی گربه Pro - متنوع,پورینا اسباب‌بازی گربه Pro - پروتئین بالا ۳۲% | برای همه نژادها | طبیعی ۱۰۰%. مناسب برای کاربران لوازم حیوانات.,1450000,25,5,3.0,2539,متنوع,۶ ماه گارانتی,پروتئین بالا ۳۲% | برای همه نژادها | طبیعی ۱۰۰% | ویتامین‌های ضروری,سلامت، حیوانات خانگی، گربه، سگ
240,تلویزیون,هایسنس,OLED C3 55 Pro,هایسنس OLED C3 55 Pro - خاکستری تیره,محصول هایسنس مدل OLED C3 55 Pro با ویژگی‌های HDR10+ | کیفیت 4K OLED | اسمارت TV. بهترین انتخاب در دسته تلویزیون.,124275000,15,100,2.6,2803,خاکستری تیره,بدون گارانتی,HDR10+ | کیفیت 4K OLED | اسمارت TV | Google TV,TV، 4K، سینمای خانگی، تلویزیون
241,پوشاک مردانه,پیکره,شلوار جین Max,پیکره شلوار جین Max - کاکی,پیکره شلوار جین Max - قابل شستشو در ماشین | سایزبندی استاندارد | ضدچروک. مناسب برای کاربران پوشاک مردانه.,1960000,10,20,4.3,1832,کاکی,۲۴ ماه گارانتی,قابل شستشو در ماشین | سایزبندی استاندارد | ضدچروک | تنفس‌پذیر,ورزشی، مردانه، پوشاک، کژوال
242,اسباب‌بازی,دوتو,Nerf Elite (2024),دوتو Nerf Elite (2024) - زرد,Nerf Elite (2024) از برند معتبر دوتو. بی‌خطر بدون BPA | قابل شستشو | قطعات لاستیکی نرم. کیفیت تضمینی.,1255000,0,15,3.6,1707,زرد,۱۲ ماه گارانتی,بی‌خطر بدون BPA | قابل شستشو | قطعات لاستیکی نرم | رنگ غیر سمی,کودک، خلاقیت، لگو، آموزشی
243,چای‌ساز,پارس,42443 SE,پارس 42443 SE - قرمز,پارس 42443 SE - حرارت سریع | ظرفیت ۲ لیتر | حفظ گرما. مناسب برای کاربران چای‌ساز.,3190000,30,5,4.4,2403,قرمز,۱۲ ماه گارانتی,حرارت سریع | ظرفیت ۲ لیتر | حفظ گرما | بدنه استیل,چای‌ساز، کتری برقی، خانگی، آشپزخانه
244,لوازم آرایشی,لورئال,ریمل ویژه,لورئال ریمل ویژه - متنوع,پیشنهاد ویژه: لورئال ریمل ویژه. رنگ‌های متنوع | بدون پارابن | تست شده توسط چشم‌پزشک. ارسال سریع.,3030000,0,30,3.8,2361,متنوع,۱۲ ماه گارانتی,رنگ‌های متنوع | بدون پارابن | تست شده توسط چشم‌پزشک | پوشش کامل,زیبایی، بهداشتی، زنانه، آرایشی
245,مودم,تی‌پی‌لینک,Archer AX73,تی‌پی‌لینک Archer AX73 - مشکی,محصول تی‌پی‌لینک مدل Archer AX73 با ویژگی‌های VPN داخلی | Wi-Fi 6 AX5400 | پردازنده ۱.۸ گیگاهرتز. بهترین انتخاب در دسته مودم.,9515000,20,0,2.5,1412,مشکی,۱۲ ماه گارانتی,VPN داخلی | Wi-Fi 6 AX5400 | پردازنده ۱.۸ گیگاهرتز | MU-MIMO,اینترنت، روتر، خانه هوشمند، مودم
246,کفش,نایک,Ultraboost 22 Plus,نایک Ultraboost 22 Plus - قرمز,پیشنهاد ویژه: نایک Ultraboost 22 Plus. رویه چرم طبیعی | سایزبندی ۳۶-۴۶ | زیره لاستیکی ضدلغزش. ارسال سریع.,4855000,10,50,4.0,1836,قرمز,۱۸ ماه گارانتی,رویه چرم طبیعی | سایزبندی ۳۶-۴۶ | زیره لاستیکی ضدلغزش | قابل شستشو,اسپورت، رسمی، کوهنوردی، ورزشی
247,پرینتر,Epson,PIXMA G6020 Plus,Epson PIXMA G6020 Plus - مشکی,Epson PIXMA G6020 Plus - چاپ موبایل | فکس | چاپ دو رو خودکار. مناسب برای کاربران پرینتر.,18260000,0,15,4.5,2305,مشکی,۶ ماه گارانتی,چاپ موبایل | فکس | چاپ دو رو خودکار | چاپ رنگی,جوهرافشان، خانگی، لیزر، اداری
248,لپ‌تاپ,لنوو,IdeaPad 5 (نسخه جدید),لنوو IdeaPad 5 (نسخه جدید) - مشکی,IdeaPad 5 (نسخه جدید) از برند معتبر لنوو. باتری ۱۰ ساعته | SSD 512 گیگ | پورت Thunderbolt 4. کیفیت تضمینی.,39325000,10,150,3.7,3470,مشکی,۱۲ ماه گارانتی,باتری ۱۰ ساعته | SSD 512 گیگ | پورت Thunderbolt 4 | رم ۱۶ گیگ,لپ‌تاپ، سبک، اداری، گیمینگ
249,لوازم خودرو,شل,جاروب‌برقی ماشین Lite,شل جاروب‌برقی ماشین Lite - نقره‌ای,محصول شل مدل جاروب‌برقی ماشین Lite با ویژگی‌های شارژ سریع | دوربین ۴K | صفحه لمسی ۳.۵ اینچ. بهترین انتخاب در دسته لوازم خودرو.,7460000,10,50,4.2,2926,نقره‌ای,بدون گارانتی,شارژ سریع | دوربین ۴K | صفحه لمسی ۳.۵ اینچ | GPS مکان‌یاب,GPS، ایمنی، خودرو، دوربین
250,مانیتور,سامسونگ,ProArt PA279CV (نسخه جدید),سامسونگ ProArt PA279CV (نسخه جدید) - سفید,پیشنهاد ویژه: سامسونگ ProArt PA279CV (نسخه جدید). پوشش رنگی sRGB 99% | زمان پاسخ ۱ms | پشتیبانی HDR400. ارسال سریع.,25275000,20,30,3.9,3262,سفید,۳۶ ماه گارانتی,پوشش رنگی sRGB 99% | زمان پاسخ ۱ms | پشتیبانی HDR400 | نرخ تازه‌سازی ۱۴۴Hz,گیمینگ، 4K، مانیتور، اداری
251,تجهیزات کمپینگ,جک ولف سکین,کیسه خواب -۱۰ ویژه,جک ولف سکین کیسه خواب -۱۰ ویژه - خاکی,پیشنهاد ویژه: جک ولف سکین کیسه خواب -۱۰ ویژه. پوشش UV | ستون آلومینیومی | استرپ کمپرسیون. ارسال سریع.,6640000,5,10,4.5,252,خاکی,۱۸ ماه گارانتی,پوشش UV | ستون آلومینیومی | استرپ کمپرسیون | مقاوم در برابر باد ۶۰ کیلومتر,طبیعت‌گردی، ماجراجویی، ورزش، کوهنوردی
252,کیبورد,لاجیتک,ROG Strix Scope (2024),لاجیتک ROG Strix Scope (2024) - خاکستری,محصول لاجیتک مدل ROG Strix Scope (2024) با ویژگی‌های سوئیچ مکانیکی Cherry MX | بلوتوث بی‌سیم | ضدآب. بهترین انتخاب در دسته کیبورد.,10200000,0,0,3.6,2873,خاکستری,۱۲ ماه گارانتی,سوئیچ مکانیکی Cherry MX | بلوتوث بی‌سیم | ضدآب | فرم فاکتور تک‌لار,اداری، کیبورد، RGB، گیمینگ
253,چای‌ساز,فیلیپس,BY500 (2024),فیلیپس BY500 (2024) - مشکی,فیلیپس BY500 (2024) - دمای قابل تنظیم | صفحه لمسی | بدنه استیل. مناسب برای کاربران چای‌ساز.,3305000,5,150,4.8,1484,مشکی,بدون گارانتی,دمای قابل تنظیم | صفحه لمسی | بدنه استیل | چراغ LED,خانگی، کتری برقی، چای‌ساز، آشپزخانه
254,هدفون,سنهایزر,ROG Delta Pro,سنهایزر ROG Delta Pro - سفید,سنهایزر ROG Delta Pro - حذف نویز فعال ANC | فرکانس پاسخ ۲۰-۲۰۰۰۰ هرتز | باتری ۳۰ ساعته. مناسب برای کاربران هدفون.,3760000,5,150,2.8,1863,سفید,۲۴ ماه گارانتی,حذف نویز فعال ANC | فرکانس پاسخ ۲۰-۲۰۰۰۰ هرتز | باتری ۳۰ ساعته | اتصال بلوتوث ۵.۳,استودیو، بی‌سیم، ANC، بازی
255,تجهیزات کمپینگ,نورث فیس,تشک بادی ویژه,نورث فیس تشک بادی ویژه - سبز,نورث فیس تشک بادی ویژه - نصب ۵ دقیقه‌ای | استرپ کمپرسیون | تنفس‌پذیر GoreTex. مناسب برای کاربران تجهیزات کمپینگ.,11795000,0,100,3.8,2412,سبز,۱۸ ماه گارانتی,نصب ۵ دقیقه‌ای | استرپ کمپرسیون | تنفس‌پذیر GoreTex | مقاوم در برابر باد ۶۰ کیلومتر,کمپینگ، ورزش، ماجراجویی، طبیعت‌گردی
256,لوازم آرایشی,مایبلین,ضدآفتاب (2024),مایبلین ضدآفتاب (2024) - متنوع,محصول مایبلین مدل ضدآفتاب (2024) با ویژگی‌های مناسب پوست حساس | ماندگاری ۲۴ ساعته | فرمول ضدآب. بهترین انتخاب در دسته لوازم آرایشی.,2230000,5,15,4.5,2293,متنوع,۶ ماه گارانتی,مناسب پوست حساس | ماندگاری ۲۴ ساعته | فرمول ضدآب | SPF 30,زنانه، آرایشی، بهداشتی، زیبایی
257,ماشین لباسشویی,اسنوا,WAV28EH0 Lite,اسنوا WAV28EH0 Lite - سفید,WAV28EH0 Lite از برند معتبر اسنوا. صرفه‌جویی در آب | دور ۱۴۰۰ rpm | تشخیص بار. کیفیت تضمینی.,27340000,10,20,4.6,2856,سفید,۳۶ ماه گارانتی,صرفه‌جویی در آب | دور ۱۴۰۰ rpm | تشخیص بار | ظرفیت ۹ کیلوگرم,ماشین لباسشویی، تمام اتوماتیک، اینورتر، لوازم خانگی
258,عطر,آرمانی,Aqva Lite,آرمانی Aqva Lite - آبی,آرمانی Aqva Lite - پخش مه ریز | بوی تازه سیتروسی | اسپری محافظت. مناسب برای کاربران عطر.,6725000,15,15,3.1,1783,آبی,۶ ماه گارانتی,پخش مه ریز | بوی تازه سیتروسی | اسپری محافظت | بوی مردانه خشبی,ادکلن، هدیه، لوکس، مردانه
